{
  "$schema": "https://overkill-factory.dev/schemas/canonical-runtime-rulebook.schema.json",
  "record_type": "canonical_runtime_gate_report",
  "rulebook_summary": {
    "checkpoints_checked": 118,
    "runtime_rules": 113,
    "non_runtime_processes": 5,
    "unmapped_actionable_checkpoints": 0
  },
  "result": "PASS",
  "blockers": []
}
